subject_id	subject_label
NCIT:C173088	Sinonasal NUT Carcinoma
NCIT:C173089	Sinonasal Neuroendocrine Carcinoma
NCIT:C202990	Sinonasal Neuroendocrine Neoplasm
NCIT:C202991	Sinonasal Neuroendocrine Tumor
NCIT:C203007	Sinonasal Neuroendocrine Tumor G1
NCIT:C203010	Sinonasal Neuroendocrine Tumor G2
NCIT:C173144	Sinonasal Neurofibroma
NCIT:C173171	Sinonasal Non-Hodgkin Lymphoma
NCIT:C173174	Sinonasal Olfactory Neuroblastoma
NCIT:C54345	Sinonasal Oncocytic Papilloma
NCIT:C4117	Sinonasal Papilloma
NCIT:C173169	Sinonasal Plasmacytoma
NCIT:C173114	Sinonasal Pleomorphic Adenoma
NCIT:C154324	Sinonasal Poorly Differentiated Carcinoma
NCIT:C173124	Sinonasal Rhabdomyosarcoma
NCIT:C173118	Sinonasal Sarcoma
NCIT:C173143	Sinonasal Schwannoma
NCIT:C116318	Sinonasal Small Cell Neuroendocrine Carcinoma
NCIT:C202852	Sinonasal Smooth Muscle Tumor of Uncertain Malignant Potential
NCIT:C173117	Sinonasal Soft Tissue Neoplasm
NCIT:C173137	Sinonasal Solitary Fibrous Tumor
NCIT:C173079	Sinonasal Spindle Cell Squamous Carcinoma
NCIT:C173128	Sinonasal Synovial Sarcoma
NCIT:C173094	Sinonasal Teratocarcinosarcoma
NCIT:C202981	Sinonasal Teratoma
NCIT:C190160	Sinonasal Tract Myxoma
NCIT:C173121	Sinonasal Undifferentiated Pleomorphic Sarcoma
NCIT:C21873	Sinus Histiocytosis of Mouse
NCIT:C172206	Sinusoidal Hemangioma
NCIT:C23107	Skeletal Muscle Neoplasms of the Mouse Nose and Paranasal Sinuses
NCIT:C23077	Skeletal Muscle Neoplasms of the Mouse Pharynx
NCIT:C180948	Skene Gland Adenocarcinoma of the Urethra
NCIT:C170478	Skin Angiolipoma
NCIT:C7580	Skin Appendage Adenoma
NCIT:C170472	Skin Atypical Lipomatous Tumor/Well Differentiated Liposarcoma
NCIT:C38109	Skin Basal Cell Carcinoma with Adnexal Differentiation
NCIT:C4346	Skin Basal Cell Carcinoma with Sebaceous Differentiation
NCIT:C4750	Skin Cavernous Hemangioma
NCIT:C172634	Skin Ewing Sarcoma
NCIT:C4634	Skin Fibroblastic Neoplasm
NCIT:C7749	Skin Fibrohistiocytic Neoplasm
NCIT:C49078	Skin Fibrous Histiocytoma, Cellular Variant
NCIT:C49079	Skin Fibrous Histiocytoma, Epithelioid Variant
NCIT:C49076	Skin Fibrous Histiocytoma, Fibroblastic Variant
NCIT:C49077	Skin Fibrous Histiocytoma, Histiocytic Variant
NCIT:C4494	Skin Hemangioendothelioma
NCIT:C7344	Skin Intermediate Fibrohistiocytic Neoplasm
NCIT:C3550	Skin Kaposi Sarcoma
NCIT:C54665	Skin Keratotic Basal Cell Carcinoma
NCIT:C5566	Skin Lipomatous Neoplasm
NCIT:C4370	Skin Lymphangioleiomyomatosis
NCIT:C165467	Skin Lymphoepithelial Carcinoma
NCIT:C167370	Skin Myoepithelioma
NCIT:C172632	Skin Myxofibrosarcoma
NCIT:C6578	Skin Myxoma
NCIT:C62282	Skin Nodular Basal Cell Carcinoma
NCIT:C5616	Skin Nodular Solid Basal Cell Carcinoma
NCIT:C204355	Skin Nodulocystic Basal Cell Carcinoma
NCIT:C170476	Skin Pleomorphic Lipoma
NCIT:C170473	Skin Pleomorphic Liposarcoma
NCIT:C27719	Skin Radiation-Related Angiosarcoma
NCIT:C4480	Skin Smooth Muscle Neoplasm
NCIT:C169100	Skin Soft Tissue Neoplasm
NCIT:C170475	Skin Spindle Cell Lipoma
NCIT:C170474	Skin Spindle Cell/Pleomorphic Lipoma
NCIT:C165466	Skin Squamous Cell Carcinoma with Osteoclast-Like Giant Cells
NCIT:C165468	Skin Squamous Cell Carcinoma with Sarcomatoid Differentiation
NCIT:C205551	Skin Syncytial Myoepithelioma
NCIT:C5354	Skin Vascular Neoplasm
NCIT:C165465	Skin Verrucous Carcinoma
NCIT:C192732	Skull Base Carcinoma
NCIT:C129569	Skull Osteoma
NCIT:C21909	Small B Cell Lymphoma of the Mouse Hematologic System
NCIT:C129449	Small Cell Adenocarcinoma
NCIT:C27092	Small Cell Carcinoma, Fusiform Cell Type
NCIT:C125890	Small Cell Glioblastoma
NCIT:C4099	Small Cell Intermediate Cell Carcinoma
NCIT:C22954	Small Cell Osteosarcoma of the Mouse Skeletal System
NCIT:C7096	Small Cell Undifferentiated Hepatoblastoma
NCIT:C66754	Small Congenital Melanocytic Nevus
NCIT:C96805	Small Duct Intrahepatic Cholangiocarcinoma
NCIT:C172714	Small Hepatocellular Carcinoma
NCIT:C133893	Small Intestinal Adenocarcinoma by AJCC v8 Stage
NCIT:C43535	Small Intestinal Adenosquamous Carcinoma
NCIT:C96060	Small Intestinal Angiosarcoma
NCIT:C27410	Small Intestinal Atypical Burkitt/Burkitt-Like Lymphoma
NCIT:C96053	Small Intestinal B-Cell Non-Hodgkin Lymphoma
NCIT:C133716	Small Intestinal Cancer by AJCC v7 Stage
NCIT:C96073	Small Intestinal Composite Gangliocytoma/Neuroma and Neuroendocrine Tumor
NCIT:C27451	Small Intestinal Enterochromaffin Cell Serotonin-Producing Neuroendocrine Tumor
NCIT:C96056	Small Intestinal Follicular Lymphoma
NCIT:C27450	Small Intestinal Gastrin-Producing Neuroendocrine Tumor
NCIT:C5811	Small Intestinal Gastrointestinal Stromal Tumor
NCIT:C96057	Small Intestinal High Grade B-Cell Lymphoma, Not Otherwise Specified
NCIT:C27464	Small Intestinal High Grade Intraepithelial Neoplasia
NCIT:C5337	Small Intestinal Hodgkin Lymphoma
NCIT:C96059	Small Intestinal Kaposi Sarcoma
NCIT:C96065	Small Intestinal Large Cell Neuroendocrine Carcinoma
NCIT:C5339	Small Intestinal Lipoma
NCIT:C27463	Small Intestinal Low Grade Intraepithelial Neoplasia
NCIT:C27441	Small Intestinal Mantle Cell Lymphoma
NCIT:C43537	Small Intestinal Medullary Carcinoma
NCIT:C96066	Small Intestinal Mixed Adenoneuroendocrine Carcinoma
NCIT:C150504	Small Intestinal Monomorphic Epitheliotropic T-Cell Lymphoma
NCIT:C43536	Small Intestinal Mucinous Adenocarcinoma
NCIT:C132260	Small Intestinal Myeloid Sarcoma
NCIT:C96064	Small Intestinal Neuroendocrine Carcinoma
NCIT:C96067	Small Intestinal Neuroendocrine Tumor G2
NCIT:C172664	Small Intestinal Neuroendocrine Tumor G3
NCIT:C7231	Small Intestinal Non-Hodgkin Lymphoma
NCIT:C43543	Small Intestinal Signet Ring Cell Carcinoma
NCIT:C27449	Small Intestinal Small Cell Neuroendocrine Carcinoma
NCIT:C27453	Small Intestinal Somatostatin-Producing Neuroendocrine Tumor
NCIT:C96054	Small Intestinal T-Cell Non-Hodgkin Lymphoma
NCIT:C43538	Small Intestinal Undifferentiated Carcinoma
NCIT:C43551	Small Intestinal Villous Adenoma
NCIT:C136769	Small Intestinal, Esophageal, Colorectal, Mesenteric, and Peritoneal Gastrointestinal Stromal Tumor by AJCC v8 Stage
NCIT:C7540	Small Lymphocytic Lymphoma
NCIT:C82991	Small Lymphocytic Lymphoma Variant
NCIT:C141259	Small Lymphocytic Lymphoma by Ann Arbor Stage
NCIT:C37203	Small Lymphocytic Lymphoma with Immunoglobulin Heavy Chain Variable-Region Gene Somatic Hypermutation
NCIT:C36273	Small Lymphocytic Lymphoma with Plasmacytoid Differentiation
NCIT:C37206	Small Lymphocytic Lymphoma with Unmutated Immunoglobulin Heavy Chain Variable-Region Gene
NCIT:C172716	Small Progressed Hepatocellular Carcinoma
NCIT:C21928	Small T Cell Lymphoma of the Mouse Hematologic System
NCIT:C7178	Smoldering Adult T-Cell Leukemia/Lymphoma
NCIT:C115460	Smoldering Systemic Mastocytosis
NCIT:C188041	Smoldering Systemic Mastocytosis with an Associated Myeloid Neoplasm
NCIT:C155910	Smoldering Waldenstrom Macroglobulinemia
NCIT:C23105	Smooth Muscle Neoplasms of the Mouse Nose and Paranasal Sinuses
NCIT:C23053	Smooth Muscle Neoplasms of the Mouse Oral Cavity
NCIT:C202851	Smooth Muscle Tumor of Uncertain Malignant Potential
NCIT:C6210	Soft Palate Benign Granular Cell Tumor
NCIT:C6211	Soft Palate Pleomorphic Adenoma
NCIT:C4941	Soft Palate Squamous Cell Carcinoma
NCIT:C121671	Soft Tissue Angiosarcoma
NCIT:C27042	Soft Tissue Disorder
NCIT:C6605	Soft Tissue Fibrosarcoma
NCIT:C136707	Soft Tissue Sarcoma by AJCC v7 Stage
NCIT:C136693	Soft Tissue Sarcoma by AJCC v8 Stage
NCIT:C165190	Soft Tissue Sarcoma of the Trunk and Extremities
NCIT:C136694	Soft Tissue Sarcoma of the Trunk and Extremities by AJCC v8 Stage
NCIT:C7148	Soft Tissue Tumor of Uncertain Differentiation
NCIT:C27920	Solar Radiation-Related Cutaneous Melanoma
NCIT:C27776	Solar Radiation-Related Malignant Neoplasm
NCIT:C27921	Solar Radiation-Related Skin Squamous Cell Carcinoma
NCIT:C21774	Solid Adenocarcinoma of the Mouse Pulmonary System
NCIT:C21764	Solid Adenoma of the Mouse Pulmonary System
NCIT:C27493	Solid Alveolar Rhabdomyosarcoma
NCIT:C49110	Solid Angioleiomyoma
NCIT:C4137	Solid Carcinoma
NCIT:C205539	Solid Cystic Hidradenoma
NCIT:C51133	Solid Glomus Tumor
NCIT:C5651	Solid Lung Adenocarcinoma
NCIT:C21685	Solid Mammary Carcinoma of Mouse
NCIT:C21674	Solid Mouse MIN NOS
NCIT:C9292	Solid Neoplasm
NCIT:C201136	Solid Pseudopapillary Neoplasm
NCIT:C165261	Solid Pseudopapillary Neoplasm of the Ovary
NCIT:C46095	Solid/Trabecular Variant Thyroid Gland Papillary Carcinoma
NCIT:C5394	Solitary Adult Fibroma
NCIT:C121681	Solitary Circumscribed Neuroma
NCIT:C22034	Solitary Fibrous Tumour of the Mouse Nervous System
NCIT:C53455	Solitary Osteochondroma
NCIT:C6932	Solitary Plasmacytoma
NCIT:C177364	Somatic-Type Malignancy
NCIT:C127194	Somatotroph-Lactotroph Pituitary Neuroendocrine Tumor
NCIT:C154340	Sparsely Granulated Corticotroph Pituitary Neuroendocrine Tumor
NCIT:C45932	Sparsely Granulated Lactotroph Pituitary Neuroendocrine Tumor
NCIT:C45926	Sparsely Granulated Somatotroph Pituitary Neuroendocrine Tumor
NCIT:C186494	Spinal Cord Ependymoma, MYCN Amplified
NCIT:C201976	Spinal Cord Pilocytic Astrocytoma
NCIT:C155948	Spinal Hemangioblastoma
NCIT:C168693	Spinal Neoplasm
NCIT:C21745	Spindle Cell / Sarcomatoid Carcinoma of the Mouse Prostate Gland
NCIT:C22936	Spindle Cell Hemangioendothelioma of the Mouse Blood Vessel
NCIT:C21694	Spindle Cell Metaplastic Carcinoma of the Mouse Mammary Gland
NCIT:C94537	Spindle Cell Oncocytoma
NCIT:C27546	Spindle Cell Type Atypical Fibroxanthoma
NCIT:C27792	Spindle Cell Type Gastrointestinal Stromal Tumor
NCIT:C156045	Spindle Cell Variant Thyroid Gland Papillary Carcinoma
NCIT:C7180	Spindle Cell/Pleomorphic Lipoma
NCIT:C121654	Spindle Cell/Sclerosing Rhabdomyosarcoma
NCIT:C43333	Spindle-Cell Predominant Trichodiscoma
NCIT:C21810	Spindle-cell Squamous Cell Carcinoma of the Mouse Skin
NCIT:C167344	Spiradenocylindrocarcinoma
NCIT:C167342	Spiradenocylindroma
NCIT:C21820	Spiradenoma Type of Basaloid Follicular Neoplasm of the Mouse Skin
NCIT:C136825	Spitz Melanocytoma
NCIT:C165497	Spitz Melanoma
NCIT:C204790	Spitz Tumor
NCIT:C7310	Splenic B Lymphoblastic Lymphoma
NCIT:C80308	Splenic B-Cell Lymphoma/Leukemia, Unclassifiable
NCIT:C7309	Splenic Burkitt Lymphoma
NCIT:C7307	Splenic Follicular Lymphoma
NCIT:C7312	Splenic Lymphoblastic Lymphoma
NCIT:C48873	Splenic Lymphoma
NCIT:C7305	Splenic Lymphoplasmacytic Lymphoma
NCIT:C7299	Splenic Manifestation of B-Cell Prolymphocytic Leukemia
NCIT:C7300	Splenic Manifestation of Chronic Lymphocytic Leukemia
NCIT:C7303	Splenic Manifestation of Chronic Myeloid Leukemia, BCR-ABL1 Positive
NCIT:C7302	Splenic Manifestation of T-Cell Large Granular Lymphocyte Leukemia
NCIT:C7298	Splenic Manifestation of T-Cell Prolymphocytic Leukemia
NCIT:C21910	Splenic Marginal Zone Lymphoma of the Mouse Hematologic System
NCIT:C7294	Splenic Non-Hodgkin Lymphoma
NCIT:C185041	Splenic Plasmacytoma
NCIT:C7304	Splenic Small Lymphocytic Lymphoma
NCIT:C7311	Splenic T Lymphoblastic Lymphoma
NCIT:C66811	Spongioneuroblastoma
NCIT:C66816	Spontaneously Regressed Retinoblastoma
NCIT:C27914	Sporadic Burkitt Lymphoma
NCIT:C43351	Sporadic Cylindroma
NCIT:C43527	Sporadic Gastric Adenocarcinoma
NCIT:C43529	Sporadic Gastric Diffuse Adenocarcinoma
NCIT:C164314	Sporadic Malignant Peripheral Nerve Sheath Tumor
NCIT:C27890	Sporadic Papillary Renal Cell Carcinoma
NCIT:C42596	Sporadic Retinoblastoma
NCIT:C46098	Sporadic Thyroid Gland Medullary Carcinoma
NCIT:C46103	Sporadic Thyroid Gland Micromedullary Carcinoma
NCIT:C43347	Squamoid Eccrine Ductal Carcinoma
NCIT:C28292	Squamous Cell Carcinoma In Situ of the Nipple
NCIT:C65176	Squamous Cell Carcinoma In Situ with Questionable Stromal Invasion
NCIT:C23114	Squamous Cell Carcinoma In-situ of the Mouse Larynx
NCIT:C23050	Squamous Cell Carcinoma In-situ of the Mouse Oral Cavity
NCIT:C21805	Squamous Cell Carcinoma in Situ of the Mouse Skin
NCIT:C8099	Squamous Cell Carcinoma of Unknown Primary
NCIT:C22157	Squamous Cell Carcinoma of the Mouse Intestinal Tract
NCIT:C23113	Squamous Cell Carcinoma of the Mouse Larynx
NCIT:C23092	Squamous Cell Carcinoma of the Mouse Nose and Paranasal Sinuses
NCIT:C23049	Squamous Cell Carcinoma of the Mouse Oral Cavity
NCIT:C23070	Squamous Cell Carcinoma of the Mouse Pharynx
NCIT:C21746	Squamous Cell Carcinoma of the Mouse Prostate Gland
NCIT:C21770	Squamous Cell Carcinoma of the Mouse Pulmonary System
NCIT:C23144	Squamous Cell Carcinoma of the Mouse Salivary Glands
NCIT:C21806	Squamous Cell Carcinoma of the Mouse Skin
NCIT:C168554	Squamous Cell Carcinoma of the Mouse Tongue
NCIT:C64135	Squamous Cell Carcinoma of the Rat Bronchiole
NCIT:C64136	Squamous Cell Carcinoma of the Rat Bronchus
NCIT:C63991	Squamous Cell Carcinoma of the Rat Clitoral Gland
NCIT:C64079	Squamous Cell Carcinoma of the Rat Conjunctiva
NCIT:C63892	Squamous Cell Carcinoma of the Rat Esophagus
NCIT:C64080	Squamous Cell Carcinoma of the Rat External Ear
NCIT:C64081	Squamous Cell Carcinoma of the Rat Eyelid
NCIT:C63893	Squamous Cell Carcinoma of the Rat Forestomach
NCIT:C64137	Squamous Cell Carcinoma of the Rat Larynx
NCIT:C64138	Squamous Cell Carcinoma of the Rat Lung
NCIT:C63837	Squamous Cell Carcinoma of the Rat Mandibular Gland
NCIT:C64139	Squamous Cell Carcinoma of the Rat Nasal Cavity
NCIT:C64140	Squamous Cell Carcinoma of the Rat Nasopharynx
NCIT:C64141	Squamous Cell Carcinoma of the Rat Paranasal Sinus
NCIT:C63838	Squamous Cell Carcinoma of the Rat Parotid Gland
NCIT:C64082	Squamous Cell Carcinoma of the Rat Preputial Gland
NCIT:C64142	Squamous Cell Carcinoma of the Rat Renal Pelvis
NCIT:C63839	Squamous Cell Carcinoma of the Rat Salivary Gland
NCIT:C64156	Squamous Cell Carcinoma of the Rat Skin
NCIT:C63840	Squamous Cell Carcinoma of the Rat Sublingual Gland
NCIT:C64167	Squamous Cell Carcinoma of the Rat Tongue
NCIT:C64143	Squamous Cell Carcinoma of the Rat Trachea
NCIT:C64144	Squamous Cell Carcinoma of the Rat Ureter
NCIT:C64145	Squamous Cell Carcinoma of the Rat Urethra
NCIT:C64146	Squamous Cell Carcinoma of the Rat Urinary Bladder
NCIT:C63992	Squamous Cell Carcinoma of the Rat Uterine Cervix
NCIT:C63993	Squamous Cell Carcinoma of the Rat Uterus
NCIT:C63994	Squamous Cell Carcinoma of the Rat Vagina
NCIT:C64083	Squamous Cell Carcinoma of the Rat Zymbal Gland
NCIT:C191749	Squamous Cell Carcinoma of the Urinary Tract
NCIT:C65179	Squamous Cell Carcinoma with Horn Formation
NCIT:C65180	Squamous Cell Carcinoma, Clear Cell Type
NCIT:C64301	Squamous Cell Hyperplasia of the Rat Clitoral Gland
NCIT:C64302	Squamous Cell Hyperplasia of the Rat Esophagus
NCIT:C64303	Squamous Cell Hyperplasia of the Rat External Ear
NCIT:C64304	Squamous Cell Hyperplasia of the Rat Forestomach
NCIT:C64305	Squamous Cell Hyperplasia of the Rat Larynx
NCIT:C64306	Squamous Cell Hyperplasia of the Rat Preputial Gland
NCIT:C64307	Squamous Cell Hyperplasia of the Rat Skin Subcutaneous Tissue
NCIT:C64308	Squamous Cell Hyperplasia of the Rat Tongue
NCIT:C64309	Squamous Cell Hyperplasia of the Rat Vagina
NCIT:C64310	Squamous Cell Hyperplasia of the Rat Zymbal Gland
NCIT:C64311	Squamous Cell Metaplasia of the Rat Bronchiole
NCIT:C64312	Squamous Cell Metaplasia of the Rat Bronchus
NCIT:C64313	Squamous Cell Metaplasia of the Rat Clitoral Gland
NCIT:C64314	Squamous Cell Metaplasia of the Rat Larynx
NCIT:C64315	Squamous Cell Metaplasia of the Rat Lung
NCIT:C63841	Squamous Cell Metaplasia of the Rat Mandibular Gland
NCIT:C64316	Squamous Cell Metaplasia of the Rat Nasopharynx
NCIT:C64317	Squamous Cell Metaplasia of the Rat Paranasal Sinus
NCIT:C63842	Squamous Cell Metaplasia of the Rat Parotid Gland
NCIT:C64318	Squamous Cell Metaplasia of the Rat Preputial Gland
NCIT:C64319	Squamous Cell Metaplasia of the Rat Renal Pelvis
NCIT:C63843	Squamous Cell Metaplasia of the Rat Salivary Gland
NCIT:C63844	Squamous Cell Metaplasia of the Rat Sublingual Gland
NCIT:C64320	Squamous Cell Metaplasia of the Rat Trachea
NCIT:C64321	Squamous Cell Metaplasia of the Rat Ureter
NCIT:C64322	Squamous Cell Metaplasia of the Rat Urethra
NCIT:C64323	Squamous Cell Metaplasia of the Rat Urinary Bladder
NCIT:C64147	Squamous Cell Papilloma of the Rat Bronchiole
NCIT:C64148	Squamous Cell Papilloma of the Rat Bronchus
NCIT:C63995	Squamous Cell Papilloma of the Rat Clitoral Gland
NCIT:C64084	Squamous Cell Papilloma of the Rat Conjunctiva
NCIT:C63894	Squamous Cell Papilloma of the Rat Esophagus
NCIT:C64085	Squamous Cell Papilloma of the Rat External Ear
NCIT:C64086	Squamous Cell Papilloma of the Rat Eyelid
NCIT:C63895	Squamous Cell Papilloma of the Rat Forestomach
NCIT:C64149	Squamous Cell Papilloma of the Rat Larynx
NCIT:C64150	Squamous Cell Papilloma of the Rat Nasal Cavity
NCIT:C64151	Squamous Cell Papilloma of the Rat Nasopharynx
NCIT:C64152	Squamous Cell Papilloma of the Rat Paranasal Sinus
NCIT:C64087	Squamous Cell Papilloma of the Rat Preputial Gland
NCIT:C64157	Squamous Cell Papilloma of the Rat Skin
NCIT:C64166	Squamous Cell Papilloma of the Rat Tongue
NCIT:C64153	Squamous Cell Papilloma of the Rat Trachea
NCIT:C64154	Squamous Cell Papilloma of the Rat Urethra
NCIT:C64155	Squamous Cell Papilloma of the Rat Urinary Bladder
NCIT:C63996	Squamous Cell Papilloma of the Rat Uterine Cervix
NCIT:C63997	Squamous Cell Papilloma of the Rat Uterus
NCIT:C63998	Squamous Cell Papilloma of the Rat Vagina
NCIT:C21767	Squamous Dysplasia of the Mouse Pulmonary System
NCIT:C21800	Squamous Hyperplasia of the Mouse Skin
NCIT:C21801	Squamous Hyperplasia of the Mouse Skin with Atypia
NCIT:C22108	Squamous Metaplasia of the Mouse Intestinal Tract
NCIT:C21692	Squamous Metaplastic Carcinoma of the Mouse Mammary Gland
NCIT:C21798	Squamous Neoplasms of the Mouse Skin
NCIT:C21658	Squamous Nodule of the Mouse Mammary Gland
NCIT:C7112	Squamous Odontogenic Tumor
NCIT:C191740	Squamous Papilloma of the Urinary Tract
NCIT:C21799	Squamous Proliferative Disorders of the Mouse Skin
NCIT:C141217	St. Jude Childhood Non-Hodgkin Lymphoma by AJCC v8 Stage
NCIT:C141218	St. Jude Stage I Childhood Non-Hodgkin Lymphoma AJCC v8
NCIT:C141219	St. Jude Stage II Childhood Non-Hodgkin Lymphoma AJCC v8
NCIT:C141220	St. Jude Stage III Childhood Non-Hodgkin Lymphoma AJCC v8
NCIT:C141221	St. Jude Stage IV Childhood Non-Hodgkin Lymphoma AJCC v8
NCIT:C27282	Stage 0 AIDS-Related Anal Canal Cancer AJCC v6 and v7
NCIT:C4444	Stage 0 Ampulla of Vater Cancer AJCC v7
NCIT:C134865	Stage 0 Ampulla of Vater Cancer AJCC v8
NCIT:C133795	Stage 0 Anal Cancer AJCC v8
NCIT:C134118	Stage 0 Appendix Carcinoma AJCC v8
NCIT:C8894	Stage 0 Bladder Adenocarcinoma AJCC v6 and v7
NCIT:C7895	Stage 0 Bladder Cancer AJCC v6 and v7
NCIT:C8903	Stage 0 Bladder Squamous Cell Carcinoma AJCC v6 and v7
NCIT:C89550	Stage 0 Cervical Cancer AJCC v7
NCIT:C198180	Stage 0 Childhood Retinoblastoma by Toronto Guidelines v2
NCIT:C7847	Stage 0 Chronic Lymphocytic Leukemia
NCIT:C134271	Stage 0 Colon Cancer AJCC v8
NCIT:C8932	Stage 0 Colorectal Cancer AJCC v6 and v7
NCIT:C134182	Stage 0 Colorectal Cancer AJCC v8
NCIT:C8423	Stage 0 Cutaneous Melanoma AJCC v6 and v7
NCIT:C85887	Stage 0 Cutaneous Merkel Cell Carcinoma AJCC v7
NCIT:C133255	Stage 0 Cutaneous Squamous Cell Carcinoma of the Head and Neck AJCC v8
NCIT:C88027	Stage 0 Digestive System Neuroendocrine Tumor AJCC v7
NCIT:C88089	Stage 0 Distal Bile Duct Cancer AJCC v7
NCIT:C134812	Stage 0 Distal Bile Duct Cancer AJCC v8
NCIT:C8629	Stage 0 Esophageal Adenocarcinoma AJCC v7
NCIT:C3637	Stage 0 Esophageal Cancer AJCC v6
NCIT:C5023	Stage 0 Esophageal Squamous Cell Carcinoma AJCC v7
NCIT:C88120	Stage 0 Eyelid Carcinoma AJCC v7
NCIT:C140515	Stage 0 Eyelid Carcinoma AJCC v8
NCIT:C40105	Stage 0 Fallopian Tube Cancer AJCC v7
NCIT:C4439	Stage 0 Gallbladder Cancer AJCC v6 and v7
NCIT:C134663	Stage 0 Gallbladder Cancer AJCC v8
NCIT:C88058	Stage 0 Hilar Cholangiocarcinoma AJCC v7
NCIT:C134744	Stage 0 Hilar Cholangiocarcinoma AJCC v8
NCIT:C6048	Stage 0 Hypopharyngeal Squamous Cell Carcinoma AJCC v6, v7, and v8
NCIT:C134609	Stage 0 Intrahepatic Bile Duct Cancer AJCC v8
NCIT:C88049	Stage 0 Intrahepatic Cholangiocarcinoma AJCC v7
NCIT:C134756	Stage 0 Intrahepatic Cholangiocarcinoma AJCC v8
NCIT:C6121	Stage 0 Laryngeal Squamous Cell Carcinoma AJCC v6, v7, and v8
NCIT:C6128	Stage 0 Laryngeal Verrucous Carcinoma AJCC v6, v7, and v8
NCIT:C5893	Stage 0 Lip Basal Cell Carcinoma AJCC v6 and v7
NCIT:C7939	Stage 0 Lip and Oral Cavity Cancer AJCC v6 and v7
NCIT:C134119	Stage 0 Low Grade Appendix Mucinous Neoplasm (LAMN) AJCC v8
NCIT:C8758	Stage 0 Lung Adenocarcinoma AJCC v6 and v7
NCIT:C8748	Stage 0 Lung Adenosquamous Carcinoma AJCC v6 and v7
NCIT:C136469	Stage 0 Lung Cancer AJCC v8
NCIT:C35758	Stage 0 Lung Large Cell Carcinoma AJCC v6 and v7
NCIT:C9104	Stage 0 Lung Non-Small Cell Cancer AJCC v6 and v7
NCIT:C8763	Stage 0 Lung Squamous Cell Carcinoma AJCC v6 and v7
NCIT:C132783	Stage 0 Major Salivary Gland Cancer AJCC v8
NCIT:C6036	Stage 0 Nasopharyngeal Keratinizing Squamous Cell Carcinoma AJCC v6, v7, and v8
NCIT:C6035	Stage 0 Nasopharyngeal Undifferentiated Carcinoma AJCC v6, v7, and v8
NCIT:C6052	Stage 0 Oral Cavity Squamous Cell Carcinoma AJCC v6 and v7
NCIT:C5892	Stage 0 Oral Cavity Verrucous Carcinoma
NCIT:C132995	Stage 0 Oropharyngeal (p16-Negative) Carcinoma AJCC v8
NCIT:C6039	Stage 0 Oropharyngeal Squamous Cell Carcinoma AJCC v6 and v7
NCIT:C5729	Stage 0 Pancreatic Cancer AJCC v6 and v7
NCIT:C134914	Stage 0 Pancreatic Cancer AJCC v8
NCIT:C94768	Stage 0 Paranasal Sinus Cancer AJCC v6, v7, and v8
NCIT:C3643	Stage 0 Penile Cancer AJCC v6
NCIT:C89194	Stage 0 Penile Cancer AJCC v7
NCIT:C140076	Stage 0 Penile Cancer AJCC v8
NCIT:C134291	Stage 0 Rectal Cancer AJCC v8
NCIT:C5017	Stage 0 Rectosigmoid Cancer AJCC v6 and v7
NCIT:C6193	Stage 0 Renal Pelvis Cancer AJCC v7
NCIT:C39850	Stage 0 Renal Pelvis and Ureter Cancer AJCC v7
NCIT:C87498	Stage 0 Sinonasal Cancer AJCC v6, v7, and v8
NCIT:C133894	Stage 0 Small Intestinal Adenocarcinoma AJCC v8
NCIT:C4892	Stage 0 Small Intestinal Cancer AJCC v7
NCIT:C4523	Stage 0 Testicular Cancer AJCC v6 and v7
NCIT:C140226	Stage 0 Testicular Cancer AJCC v8
NCIT:C4116	Stage 0 Transitional Cell Carcinoma
NCIT:C6149	Stage 0 Ureter Cancer AJCC v7
NCIT:C6195	Stage 0 Urethral Cancer AJCC v7
NCIT:C9071	Stage 0 Uterine Corpus Cancer AJCC v6
NCIT:C89632	Stage 0 Uterine Corpus Cancer AJCC v7
NCIT:C7855	Stage 0 Vaginal Cancer AJCC v6
NCIT:C89476	Stage 0 Vaginal Cancer AJCC v7
NCIT:C4522	Stage 0 Vulvar Cancer AJCC v6
NCIT:C89445	Stage 0 Vulvar Cancer AJCC v7
NCIT:C140417	Stage 0a Bladder Cancer AJCC v8
NCIT:C9267	Stage 0a Bladder Urothelial Carcinoma AJCC v6 and v7
NCIT:C140078	Stage 0a Penile Cancer AJCC v8
NCIT:C6202	Stage 0a Renal Pelvis Cancer AJCC v7
NCIT:C140359	Stage 0a Renal Pelvis Cancer AJCC v8
NCIT:C7517	Stage 0a Renal Pelvis and Ureter Cancer AJCC v7
NCIT:C140358	Stage 0a Renal Pelvis and Ureter Cancer AJCC v8
NCIT:C6203	Stage 0a Ureter Cancer AJCC v7
NCIT:C140360	Stage 0a Ureter Cancer AJCC v8
NCIT:C6196	Stage 0a Urethral Cancer AJCC v7
NCIT:C140458	Stage 0a Urethral Cancer AJCC v8
NCIT:C140418	Stage 0is Bladder Cancer AJCC v8
NCIT:C140077	Stage 0is Penile Cancer AJCC v8
NCIT:C140362	Stage 0is Renal Pelvis Cancer AJCC v8
NCIT:C7518	Stage 0is Renal Pelvis and Ureter Cancer AJCC v7
NCIT:C140361	Stage 0is Renal Pelvis and Ureter Cancer AJCC v8
NCIT:C140363	Stage 0is Ureter Cancer AJCC v8
NCIT:C140459	Stage 0is Urethral Cancer AJCC v8
NCIT:C6638	Stage 1 Neuroblastoma
NCIT:C6639	Stage 2 Neuroblastoma
NCIT:C102845	Stage 2A Neuroblastoma
NCIT:C102846	Stage 2B Neuroblastoma
NCIT:C6640	Stage 3 Neuroblastoma
NCIT:C6641	Stage 4 Neuroblastoma
NCIT:C9504	Stage 4S Neuroblastoma
NCIT:C141209	Stage A Chronic Lymphocytic Leukemia
NCIT:C7556	Stage A Prostate Cancer
NCIT:C141210	Stage B Chronic Lymphocytic Leukemia
NCIT:C7554	Stage B Prostate Cancer
NCIT:C141211	Stage C Chronic Lymphocytic Leukemia
NCIT:C7552	Stage C Prostate Cancer
NCIT:C7099	Stage D Prostate Cancer
NCIT:C27283	Stage I AIDS-Related Anal Canal Cancer AJCC v6 and v7
NCIT:C8781	Stage I Acral Lentiginous Melanoma AJCC v7
NCIT:C9214	Stage I Adrenal Cortical Carcinoma AJCC v7
NCIT:C141101	Stage I Adrenal Cortical Carcinoma AJCC v8
NCIT:C141129	Stage I Adrenal Gland Pheochromocytoma and Sympathetic Paraganglioma AJCC v8
NCIT:C8077	Stage I Adult Diffuse Large Cell Lymphoma
NCIT:C8076	Stage I Adult Diffuse Mixed Cell Lymphoma
NCIT:C8075	Stage I Adult Diffuse Small Cleaved Cell Lymphoma
NCIT:C94775	Stage I Adult Liver Cancer AJCC v7
NCIT:C7818	Stage I Adult Soft Tissue Sarcoma AJCC v7
NCIT:C6651	Stage I Ampulla of Vater Cancer AJCC v7
NCIT:C134866	Stage I Ampulla of Vater Cancer AJCC v8
NCIT:C135082	Stage I Ampulla of Vater Neuroendocrine Tumor AJCC v8
NCIT:C9037	Stage I Anal Canal Cancer AJCC v6 and v7
NCIT:C133796	Stage I Anal Cancer AJCC v8
NCIT:C87798	Stage I Appendix Carcinoma AJCC v7
NCIT:C134120	Stage I Appendix Carcinoma AJCC v8
NCIT:C87809	Stage I Appendix Neuroendocrine Tumor AJCC v7
NCIT:C135157	Stage I Appendix Neuroendocrine Tumor AJCC v8
NCIT:C8895	Stage I Bladder Adenocarcinoma AJCC v6 and v7
NCIT:C7896	Stage I Bladder Cancer AJCC v6 and v7
NCIT:C140419	Stage I Bladder Cancer AJCC v8
NCIT:C8899	Stage I Bladder Cancer with Carcinoma In Situ
NCIT:C8901	Stage I Bladder Cancer without Carcinoma In Situ
NCIT:C6191	Stage I Bladder Urothelial Carcinoma AJCC v6 and v7
NCIT:C87178	Stage I Bone Cancer AJCC v7
NCIT:C136613	Stage I Bone Cancer AJCC v8
NCIT:C6704	Stage I Bone Sarcoma AJCC v7
NCIT:C94821	Stage I Borderline Ovarian Surface Epithelial-Stromal Tumor
NCIT:C7767	Stage I Breast Cancer AJCC v6
NCIT:C88375	Stage I Breast Cancer AJCC v7
NCIT:C27327	Stage I Centroblastic Follicular Lymphoma
NCIT:C9204	Stage I Cervical Cancer AJCC v6 and v7
NCIT:C139734	Stage I Cervical Cancer AJCC v8
NCIT:C181564	Stage I Cervical Cancer AJCC v9
NCIT:C186620	Stage I Cervical Cancer FIGO 2009
NCIT:C162226	Stage I Cervical Cancer FIGO 2018
NCIT:C5710	Stage I Childhood Hepatocellular Carcinoma AJCC v6 and v7
NCIT:C198042	Stage I Childhood Hodgkin Lymphoma by Toronto Guidelines v2
NCIT:C8305	Stage I Childhood Large Cell Lymphoma
NCIT:C198096	Stage I Childhood Malignant Kidney Neoplasm Excluding Renal Cell Carcinoma by Toronto Guidelines v2, Children's Oncology Group (COG) Protocol
NCIT:C198059	Stage I Childhood Non-Hodgkin Lymphoma by Toronto Guidelines v2
