term_id	term_label	exclude_children	exclusion_reason
Orphanet:90073	hepatitis b reinfection following liver transplantation	TRUE	MONDO:excludeComplication
Orphanet:97292	Cardiogenic shock	TRUE	MONDO:excludePhenotype
Orphanet:519272	Structural developmental eye defect	TRUE	MONDO:excludePhenotype
Orphanet:522536	Structural developmental eye defect of genetic origin	TRUE	MONDO:excludePhenotype
Orphanet:94059	Uremic pruritus	TRUE	MONDO:excludePhenotype
Orphanet:90064	Acute peripheral arterial occlusion	TRUE	MONDO:excludePhenotype
Orphanet:90051	Sepsis in premature infants	TRUE	MONDO:excludePhenotype
Orphanet:506207	Rare disorder potentially indicated for transplant	TRUE	MONDO:excludeComplication
Orphanet:244275	De novo thrombotic microangiopathy after kidney transplantation	TRUE	MONDO:excludeComplication
Orphanet:268316	Complication in hemodialysis	TRUE	MONDO:excludeComplication
Orphanet:90053	Complications after hematopoietic stem cell transplantation	TRUE	MONDO:excludeComplication
Orphanet:391655	Off-periods in Parkinson disease not responding to oral treatment	TRUE	MONDO:excludeEvent
Orphanet:90078	Invasive infections due to vancomycin-resistant enterococci	FALSE	MONDO:excludeGrouping
Orphanet:519323	Syndromic macular dystrophy	FALSE	MONDO:excludeGroupingModifier
Orphanet:182222	Rare systemic disease	FALSE	MONDO:excludeGroupingModifierRare|MONDO:excludeGroupingModifier
Orphanet:519329	Rare disorder involving multiple structures of the eye	FALSE	MONDO:excludeGroupingModifierRare|MONDO:excludeGroupingMorpho
Orphanet:519284	Rare disorder of the anterior segment of the eye	FALSE	MONDO:excludeGroupingModifierRare|MONDO:excludeGroupingMorpho
Orphanet:519311	Rare disorder of the posterior segment of the eye	FALSE	MONDO:excludeGroupingModifierRare|MONDO:excludeGroupingMorpho
Orphanet:486955	Rare pediatric rheumatologic disease	FALSE	MONDO:excludeGroupingModifierRare|MONDO:excludeGroupingPopulation
Orphanet:280373	Rare pediatric systemic disease	FALSE	MONDO:excludeGroupingModifierRare|MONDO:excludeGroupingPopulation|MONDO:excludeGroupingModifier
Orphanet:542323	CAR T cell therapy-associated cytokine release syndrome	TRUE	MONDO:excludeGroupingOrigin
Orphanet:269550	Genetic non-syndromic central nervous system malformation 	FALSE	MONDO:excludeGroupingOriginGenetic
Orphanet:519306	Isolated progressive inherited retinal disorder	FALSE	MONDO:excludeGroupingOriginGenetic|MONDO:excludeGroupingModifier
Orphanet:519319	Isolated stationary inherited retinal disorder	FALSE	MONDO:excludeGroupingOriginGenetic|MONDO:excludeGroupingModifier
Orphanet:522538	rare genetic disorder of the anterior segment of the eye	FALSE	MONDO:excludeGroupingOriginGenetic|MONDO:excludeGroupingModifierRare|MONDO:excludeGroupingMorpho
Orphanet:522570	Rare genetic disorder of the posterior segment of the eye	FALSE	MONDO:excludeGroupingOriginGenetic|MONDO:excludeGroupingModifierRare|MONDO:excludeGroupingMorpho
Orphanet:522578	Rare genetic disorder involving multiple structures of the eye	FALSE	MONDO:excludeGroupingOriginGenetic|MONDO:excludeGroupingModifierRare|MONDO:excludeGroupingMorpho
Orphanet:269564	Genetic syndrome with a central nervous system malformation as a major feature	FALSE	MONDO:excludeGroupingOriginGenetic|MONDO:excludeGroupingPhenotype
Orphanet:404577	Genetic syndrome with limb malformations as a major feature	FALSE	MONDO:excludeGroupingOriginGenetic|MONDO:excludeGroupingPhenotype
Orphanet:603699	KLHL7-related disorder	FALSE	MONDO:excludeGroupingOriginMolecular
Orphanet:544590	Collagen-related glomerular basement membrane disease	FALSE	MONDO:excludeGroupingOriginMolecular
Orphanet:207090	Qualitative or quantitative defects of collagen 6	FALSE	MONDO:excludeGroupingOriginMolecular
Orphanet:538238	Neurological channelopathy of the central nervous system due to a genetic chloride channel defect	FALSE	MONDO:excludeGroupingOriginMolecular|MONDO:excludePhenotype
Orphanet:98744	Neurological channelopathy of the central nervous system due to a genetic sodium channel defect	FALSE	MONDO:excludeGroupingOriginMolecular|MONDO:excludePhenotype
Orphanet:98745	Neurological channelopathy of the central nervous system due to a genetic calcium channel defect	FALSE	MONDO:excludeGroupingOriginMolecular|MONDO:excludePhenotype
Orphanet:98746	Neurological channelopathy of the central nervous system due to a genetic potassium channel defect	FALSE	MONDO:excludeGroupingOriginMolecular|MONDO:excludePhenotype
Orphanet:98747	Neurological channelopathy of the central nervous system due to a genetic glycine receptor defect	FALSE	MONDO:excludeGroupingOriginMolecular|MONDO:excludePhenotype
Orphanet:98748	Neurological channelopathy of the central nervous system due to a genetic acetylcholine receptor defect	FALSE	MONDO:excludeGroupingOriginMolecular|MONDO:excludePhenotype
Orphanet:98749	Neurological channelopathy of the central nervous system due to a genetic GABA receptor defect	FALSE	MONDO:excludeGroupingOriginMolecular|MONDO:excludePhenotype
Orphanet:158048	Hemophagocytic syndrome associated with an infection	FALSE	MONDO:excludeGroupingPhenotype
Orphanet:564178	Primary hypomagnesemia-refractory seizures-intellectual disability syndrome	FALSE	MONDO:excludeGroupingPhenotype
Orphanet:289825	Late-onset primary lymphedema without systemic or visceral involvement	FALSE	MONDO:excludeGroupingPhenotype
Orphanet:567558	Non-genetic systemic disease with glomerulopathy as a major feature	FALSE	MONDO:excludeGroupingPhenotype
Orphanet:567562	Disorder with multisystemic involvement and glomerulopathy	FALSE	MONDO:excludeGroupingPhenotype
Orphanet:2416	Congenital primary lymphedema without systemic or visceral involvement	FALSE	MONDO:excludeGroupingPhenotype
Orphanet:525677	Genetic congenital malformation of the eye with glaucoma as a major feature	FALSE	MONDO:excludeGroupingPhenotype
Orphanet:567556	Genetic systemic disease with glomerulopathy as a major feature	FALSE	MONDO:excludeGroupingPhenotype
Orphanet:519347	Rare neuromuscular disorder with ocular motility/alignment anomaly	FALSE	MONDO:excludeGroupingPhenotype|MONDO:excludeGroupingModifierRare
Orphanet:91127	Adenovirus infection in immunocompromised patients	FALSE	MONDO:excludeGroupingPopulation
Orphanet:90052	Recurrent hepatitis C virus induced liver disease in liver transplant recipients	FALSE	MONDO:excludeGroupingPopulation
Orphanet:231080	High-grade dysplasia in patients with Barrett esophagus	FALSE	MONDO:excludeGroupingPopulation
Orphanet:217080	Pulmonary fungal infections in patients deemed at risk	FALSE	MONDO:excludeGroupingPopulation
Orphanet:137698	Cytomegalovirus disease in patients with impaired cell mediated immunity deemed at risk	FALSE	MONDO:excludeGroupingPopulation
Orphanet:231080	High-grade dysplasia in patients with Barrett esophagus	FALSE	MONDO:excludeGroupingPopulation
Orphanet:263352	Postcardiotomy right ventricular failure	TRUE	MONDO:excludePhenotype
Orphanet:238621	Ileal pouch anal anastomosis related faecal incontinence	TRUE	MONDO:excludePhenotype
Orphanet:505395	Ventilator-induced diaphragmatic dysfunction	TRUE	MONDO:excludePhenotype
Orphanet:90076	Partial deep dermal and full thickness burns	TRUE	MONDO:excludePhenotype
Orphanet:90080	Scarring in glaucoma filtration surgical procedures	TRUE	MONDO:excludePhenotype
Orphanet:C041	inactive clinical entity	TRUE	MONDO:excludeObsoleteSource
Orphanet:206634	genetic skeletal muscle disease	FALSE	MONDO:excludeGroupingOriginGenetic
Orphanet:228215	genetic dermis elastic tissue disorder	FALSE	MONDO:excludeGroupingOriginGenetic
Orphanet:622914	rare genetic nevus	FALSE	MONDO:excludeGroupingOriginGenetic
Orphanet:98495	genetic neuromuscular junction disease	FALSE	MONDO:excludeGroupingOriginGenetic
Orphanet:98737	genetic neurological muscular channelopathy	FALSE	MONDO:excludeGroupingOriginGenetic
Orphanet:519268	rare disorder with ectropion	FALSE	MONDO:excludeGroupingModifierRare
Orphanet:519345	rare disorder with optic disc malformation	FALSE	MONDO:excludeGroupingModifierRare
Orphanet:616874	rare disorder without a determined diagnosis after full investigation 	FALSE	MONDO:excludeGroupingModifierRare
Orphanet:253	spondyloepiphyseal dysplasia and spondyloepimetaphyseal dysplasia	FALSE	MONDO:excludeGrouping